{
  "version": 1,
  "status": "draft",
  "approach": "research",
  "object": "Подход к рассмотрению одного формального языка как средства представления и моделирования",
  "task": "Разработать инструкции агенту: подготовить описание языка по шести направлениям и интерпретацию общей КС «Формальный язык», то есть отдельную КМ языка; использовать единое основание для проверки ответов и согласования языков при совместном решении сложных задач. Новая КС для каждого языка не строится; общая КС уточняется в интервью. Первое применение — ЯРЭ как язык, а не одна конкретная экспликация",
  "source": "source-markup.md; исходный слайд автора и уточнения в разговоре 22–29.10.2026; exam-requirements.md и sources/exam-semester-1.docx, дата изменения источника 15.10.2026, включён автором в требования 29.10.2026",
  "restrictions": [
    {
      "id": "L1",
      "excludes": "Несколько языков как элементы одной КМ",
      "inexpressible": ["Выбор языка из множества языков внутри одной КМ", "Сравнение двух языков как объектов одной КМ"]
    },
    {
      "id": "L2",
      "excludes": "Разработка КМ SQL, UML и табличных расчётных моделей на текущем этапе",
      "inexpressible": ["Согласованное устройство КМ этих языков в текущем результате"]
    }
  ],
  "expressiveness": [
    {"id": "E1", "concept": "Прикладные задачи применения формального языка и его выразительная способность относительно предметной задачи", "ref": "source-markup.md: исходный слайд; exam-requirements.md: EX1", "constituent": null},
    {"id": "E2", "concept": "Синтаксис и грамматика описываемого языка", "ref": "source-markup.md: исходный слайд; exam-requirements.md: EX3", "constituent": null},
    {"id": "E3", "concept": "Значения выражений и методы их интерпретирования", "ref": "source-markup.md: уточнение смысла семантики; exam-requirements.md: EX4", "constituent": null},
    {"id": "E4", "concept": "Модульность, синтез и критерии корректности", "ref": "source-markup.md: уточнение синтеза ЯРЭ; exam-requirements.md: EX5", "constituent": null},
    {"id": "E5", "concept": "Изменения составных моделей, пакетное внесение изменений и пересинтез", "ref": "source-markup.md: исходный слайд; exam-requirements.md: EX6", "constituent": null},
    {"id": "E6", "concept": "ЯРЭ как язык, интерпретирующий понятия общей схемы подхода", "ref": "source-markup.md: уточнение автора 29.10.2026", "constituent": null},
    {"id": "E7", "concept": "Методы отображения выражений и моделей языка", "ref": "exam-requirements.md: EX2", "constituent": null},
    {"id": "E8", "concept": "Методы хранения выражений и моделей языка", "ref": "exam-requirements.md: EX2", "constituent": null},
    {"id": "E9", "concept": "Методы передачи выражений и моделей языка", "ref": "exam-requirements.md: EX2", "constituent": null},
    {"id": "E10", "concept": "Способы проверки синтаксиса и семантики", "ref": "exam-requirements.md: EX3", "constituent": null},
    {"id": "E11", "concept": "Хранение, отображение и передача данных из пункта о методах интерпретирования; термин источника «интерферирующих данных» требует уточнения", "ref": "exam-requirements.md: EX4", "constituent": null},
    {"id": "E12", "concept": "Проверка полноты и согласованности ответов посредством КМ; отдельная проверка фактической достоверности по источникам", "ref": "interview.md: принятый ответ на IA2", "constituent": null},
    {"id": "E13", "concept": "Унификация описаний и согласование отдельных языков для их совместного использования в сложной задаче", "ref": "interview.md: назначение, указанное автором после IA1", "constituent": null}
  ],
  "distinctions": [
    {"id": "V1", "between": ["E2", "E6"], "text": "Устройство языка и конкретная схема, записанная на этом языке, относятся к разным уровням рассмотрения", "witness": null},
    {"id": "V2", "between": ["E1", "E6"], "text": "Назначение языка не подменяется задачей одного предметного примера", "witness": null}
  ],
  "invariants": [],
  "decisions": [
    {"id": "DC1", "topic": "Единица рассмотрения", "choice": "Общая схема описывает один язык; для каждого языка создаётся отдельная КМ", "rationale": "Прямые уточнения автора"},
    {"id": "DC2", "topic": "Уровень КМ ЯРЭ", "choice": "КМ описывает ЯРЭ как формальный язык", "rationale": "Автор отверг прежнюю КМ, описывавшую конкретную эксплицированную схему"},
    {"id": "DC3", "topic": "Семантика", "choice": "Семантика относится к значениям выражений", "rationale": "Ответ автора на уточняющий вопрос"},
    {"id": "DC4", "topic": "Дополнительный источник требований", "choice": "Все шесть пунктов экзаменационного задания входят в требования рассмотрения языка", "rationale": "Автор явно поручил учесть документ до продолжения интервью"},
    {"id": "DC5", "topic": "Артефакты разбора", "choice": "Описание языка и его КМ, полученная интерпретацией общей КС; без построения новой КС для каждого языка", "rationale": "Ответ на IA1 и последующее уточнение автора"},
    {"id": "DC6", "topic": "Назначение общей КС", "choice": "Проверка ответов о языках и унификация описаний для их совместного использования; общая КС корректируется в интервью", "rationale": "Прямое пояснение автора"},
    {"id": "DC7", "topic": "Критерии проверки ответов", "choice": "КМ проверяет полноту и согласованность; фактическая достоверность дополнительно проверяется по источникам", "rationale": "Автор подтвердил предложенный ответ на IA2"}
  ],
  "scenarios": [],
  "questions": [
    {
      "round": 1,
      "text": "КМ ЯРЭ должна концептуально описывать общие механизмы языка или также воспроизводить его работу вплоть до вывода и вычисления произвольных выражений?",
      "proposed": "Сначала концептуально описать механизмы языка по всем шести направлениям экзаменационного задания, включая способы проверок, отображения, хранения и передачи; полную реализацию парсера и вычислителя не включать в цель первой версии",
      "consequence": "Определяет глубину формализации, объекты КМ и критерии её проверки"
    },
    {
      "round": 1,
      "text": "IA1: Что агент должен обязательно выдавать по итогам разбора одного формального языка?",
      "proposed": "Структурированное описание по шести направлениям; дополнительные артефакты по отдельному поручению",
      "answer": "Описание по шести направлениям, источники, примеры, ограничения и открытые вопросы. При описании строится интерпретация общей КС «Формальный язык», то есть КМ. Новая КС для языка не требуется; общую КС можно корректировать в ходе интервью."
    },
    {
      "round": 1,
      "text": "IA2: Что именно должна проверять КМ в ответах агента о языке?",
      "proposed": "Полноту и согласованность описания в терминах общей КС; фактическую достоверность дополнительно проверять по источникам",
      "consequence": "Определяет требования к общей КС и критерии приёмки отдельной интерпретации",
      "answer": "Принято. КМ проверяет полноту и согласованность, фактическая достоверность дополнительно проверяется по источникам."
    },
    {
      "round": 1,
      "text": "IA3: Как агенту определять границы разбора языка относительно его версий, диалектов и реализаций?",
      "proposed": "Описывать язык и явно выбранные реализации, отмечая уровень каждого утверждения; другие варианты и последствия приведены в interview.md",
      "consequence": "Определяет границы выводов и способ рассмотрения отображения, хранения, передачи и исполнения"
    }
  ],
  "assumptions": ["Назначение проекта предварительно классифицировано как research; глубина и формат результата уточняются в первом вопросе"],
  "openQuestions": ["Ответ на IA3 о границах языка и его реализаций", "Формальные условия проверки полноты и согласованности ответов через КМ", "Глубина описания языка и состав объектов КМ", "Различение семантики и интерпретирования", "Смысл термина «интерферирующих данных» в экзаменационном документе", "Различение способов отображения, хранения и передачи выражений и данных", "Общие определения модульности, синтеза и пересинтеза", "Сценарии приёмки КМ ЯРЭ как описания языка по всем шести пунктам экзаменационного задания", "Способы согласования отдельных КМ для совместного использования языков"]
}
