{
  "version": 1,
  "status": "confirmed",
  "approach": "education",
  "object": "Подчинение и родство сотрудников одной организации",
  "task": "Учебный пример синтеза: соединить микротеории «Начальники и подчинённые» и «Родство» и выразить правило конфликта интересов",
  "source": "examples/subordination, examples/kinship; синтез по Т1 §1.2.18",
  "restrictions": [
    {
      "id": "L1",
      "excludes": "родство дальше 1 ранга (родители, дети, братья, сёстры)",
      "inexpressible": ["подчинение внуку", "подчинение двоюродному брату"]
    }
  ],
  "expressiveness": [
    {
      "id": "E1",
      "concept": "прямое подчинение родственнику",
      "ref": "Т1 §1.2.18",
      "via": "пары прямого подчинения, где подчинённый — прямой родственник начальника",
      "constituent": "D11"
    },
    {
      "id": "E2",
      "concept": "косвенное подчинение родственнику",
      "ref": "Т1 §1.2.18",
      "via": "косвенные подчинённые, которые — прямые родственники",
      "constituent": "D12"
    }
  ],
  "distinctions": [
    {
      "id": "V1",
      "between": ["E1", "E2"],
      "text": "прямое подчинение родственнику (запрещено) ≠ косвенное (допустимо)",
      "witness": "SC1"
    }
  ],
  "invariants": [
    {
      "id": "I1",
      "text": "В прямом подчинении прямой родственник находиться не может (синтетическая аксиома)",
      "ref": "Т1 §1.2.18",
      "constituent": "A3",
      "positive": "SC1",
      "negative": "SC2"
    },
    {
      "id": "I2",
      "text": "Брат или сестра тоже не может быть в прямом подчинении",
      "ref": "Т1 §1.2.18",
      "constituent": "A3",
      "positive": "SC1",
      "negative": "SC3"
    }
  ],
  "decisions": [
    {
      "id": "DC1",
      "topic": "таблица отождествлений",
      "alternatives": [
        "отождествить люди родства и люди подчинения (исходное с исходным)",
        "оставить два базисных множества и связать отношением «является»"
      ],
      "choice": "отождествить базисные множества людей",
      "rationale": "правило говорит об одних и тех же людях; исходное с исходным отождествлять можно (Т1 §1.2.18)"
    },
    {
      "id": "DC2",
      "topic": "правило конфликта интересов",
      "choice": "синтетическая аксиома A3 и понятие нарушения D11",
      "rationale": "правило не выражается ни в одной микротеории — это новое знание синтеза"
    },
    {
      "id": "DC3",
      "topic": "косвенное подчинение родственнику",
      "choice": "без аксиомы, но выразимо понятием D12",
      "rationale": "«Запрет налагается только на прямое подчинение и родственные отношения 1 ранга» (Т1 §1.2.18): сын может быть рядовым сотрудником"
    },
    {
      "id": "DC4",
      "topic": "прямые родственники",
      "choice": "родители, дети, братья и сёстры — из микротеории родства",
      "rationale": "Т1 §1.2.18: «прямые родственные отношения: брат, сестра, сын, дочь»"
    }
  ],
  "scenarios": [
    {
      "id": "SC1",
      "title": "Директор — отец рядовых сотрудников в своей вертикали",
      "values": {
        "X1": ["boss", "ann", "bob", "kid", "sis"],
        "S1": [
          [["boss"], ["ann", "bob"]],
          [["ann"], ["kid", "sis"]]
        ],
        "S2": [
          ["boss", "kid"],
          ["boss", "sis"]
        ]
      },
      "expect": [
        {
          "of": "D11",
          "value": []
        },
        {
          "of": "D12",
          "value": [
            ["boss", "kid"],
            ["boss", "sis"]
          ]
        },
        {
          "of": "A3",
          "holds": true
        }
      ]
    },
    {
      "id": "SC2",
      "title": "Директор назначил сына начальником отдела (прямое подчинение)",
      "base": "SC1",
      "values": {
        "S1": [
          [["boss"], ["ann", "kid"]],
          [["kid"], ["bob"]]
        ]
      },
      "expect": [
        {
          "of": "A3",
          "holds": false
        },
        {
          "of": "D11",
          "value": [["boss", "kid"]]
        }
      ]
    },
    {
      "id": "SC3",
      "title": "Брат — прямой начальник сестры",
      "base": "SC1",
      "values": {
        "S1": [
          [["boss"], ["ann", "bob"]],
          [["kid"], ["sis"]]
        ]
      },
      "expect": [
        {
          "of": "A3",
          "holds": false
        }
      ]
    }
  ],
  "assumptions": [],
  "openQuestions": []
}
